{
  "backend": "jax-tpu-eager",
  "corpus_version": "1.0",
  "counts": {
    "compilation_failure": 0,
    "dtype_mismatch": 0,
    "environment_failure": 0,
    "execution_failure": 0,
    "inconclusive": 0,
    "invalid_workload": 0,
    "nondeterminism": 0,
    "numerical_discrepancy": 0,
    "pass": 40,
    "performance_regression": 0,
    "shape_mismatch": 0,
    "timeout": 0,
    "unsupported_backend": 0
  },
  "evidence_version": "1.0",
  "execution": {
    "platform": "Windows-11-10.0.29695-SP0",
    "requested_platform": "tpu"
  },
  "kind": "metamorphic-corpus-evidence",
  "properties": [
    {
      "backend": "jax-tpu-eager",
      "comparison": {
        "classification": "pass",
        "explanation": "outputs agree under the configured policy",
        "left": {
          "backend": "jax-tpu-simulated",
          "device": "TPU_0(process=0,(0,0,0,0))",
          "duration_ms": 155.6005,
          "environment": {
            "actual_devices": "cpu:0",
            "device_index": "",
            "jax": "0.10.2",
            "jax_enable_x64": "true",
            "platform": "Windows-11-10.0.29695-SP0",
            "requested_platform": "tpu",
            "simulated": "true",
            "simulation_backend": "cpu"
          },
          "error": null,
          "mode": "eager",
          "outputs": [
            {
              "dtype": "float32",
              "finite": 4,
              "shape": [
                2,
                2
              ]
            }
          ],
          "status": "ok"
        },
        "metrics": [
          {
            "dtype": "float32",
            "finite_mismatches": 0,
            "max_absolute_error": 0.0,
            "max_relative_error": 0.0,
            "mean_absolute_error": 0.0,
            "nonfinite_mismatches": 0,
            "rms_error": 0.0,
            "shape": [
              2,
              2
            ],
            "signed_zero_mismatches": 0
          }
        ],
        "policy": {
          "atol": 2e-06,
          "check_signed_zero": true,
          "equal_nan": true,
          "identifier": "dtype-aware-v1",
          "rtol": 2e-05
        },
        "right": {
          "backend": "jax-tpu-simulated",
          "device": "TPU_0(process=0,(0,0,0,0))",
          "duration_ms": 0.7575,
          "environment": {
            "actual_devices": "cpu:0",
            "device_index": "",
            "jax": "0.10.2",
            "jax_enable_x64": "true",
            "platform": "Windows-11-10.0.29695-SP0",
            "requested_platform": "tpu",
            "simulated": "true",
            "simulation_backend": "cpu"
          },
          "error": null,
          "mode": "eager",
          "outputs": [
            {
              "dtype": "float32",
              "finite": 4,
              "shape": [
                2,
                2
              ]
            }
          ],
          "status": "ok"
        }
      },
      "corpus_version": "1.0",
      "evidence_version": "1.0",
      "execution": {
        "platform": "Windows-11-10.0.29695-SP0",
        "requested_platform": "tpu"
      },
      "interpretation": "A passing property confirms this relation for the recorded bounded input and backend only; a discrepancy is an observation requiring ordinary evidence review.",
      "kind": "metamorphic-property-evidence",
      "left_workload_sha256": "f30c6ca7efc657284b4c2bfc9b19bdfe2529f1cb4c7f2e86f8fe051d5b3f5117",
      "property": {
        "description": "x + y and y + x produce equivalent elementwise outputs.",
        "identifier": "add-commutativity-v1",
        "relation": "outputs_equal",
        "title": "Elementwise addition commutes"
      },
      "requires_x64": false,
      "right_workload_sha256": "f7bdc9ef963786c129acff40051891b4e4307f127e2b9a81219be2e56c76a923",
      "seed": 0,
      "triage": "pass"
    },
    {
      "backend": "jax-tpu-eager",
      "comparison": {
        "classification": "pass",
        "explanation": "outputs agree under the configured policy",
        "left": {
          "backend": "jax-tpu-simulated",
          "device": "TPU_0(process=0,(0,0,0,0))",
          "duration_ms": 0.45,
          "environment": {
            "actual_devices": "cpu:0",
            "device_index": "",
            "jax": "0.10.2",
            "jax_enable_x64": "true",
            "platform": "Windows-11-10.0.29695-SP0",
            "requested_platform": "tpu",
            "simulated": "true",
            "simulation_backend": "cpu"
          },
          "error": null,
          "mode": "eager",
          "outputs": [
            {
              "dtype": "float32",
              "finite": 4,
              "shape": [
                2,
                2
              ]
            }
          ],
          "status": "ok"
        },
        "metrics": [
          {
            "dtype": "float32",
            "finite_mismatches": 0,
            "max_absolute_error": 0.0,
            "max_relative_error": 0.0,
            "mean_absolute_error": 0.0,
            "nonfinite_mismatches": 0,
            "rms_error": 0.0,
            "shape": [
              2,
              2
            ],
            "signed_zero_mismatches": 0
          }
        ],
        "policy": {
          "atol": 2e-06,
          "check_signed_zero": true,
          "equal_nan": true,
          "identifier": "dtype-aware-v1",
          "rtol": 2e-05
        },
        "right": {
          "backend": "jax-tpu-simulated",
          "device": "TPU_0(process=0,(0,0,0,0))",
          "duration_ms": 35.4121,
          "environment": {
            "actual_devices": "cpu:0",
            "device_index": "",
            "jax": "0.10.2",
            "jax_enable_x64": "true",
            "platform": "Windows-11-10.0.29695-SP0",
            "requested_platform": "tpu",
            "simulated": "true",
            "simulation_backend": "cpu"
          },
          "error": null,
          "mode": "eager",
          "outputs": [
            {
              "dtype": "float32",
              "finite": 4,
              "shape": [
                2,
                2
              ]
            }
          ],
          "status": "ok"
        }
      },
      "corpus_version": "1.0",
      "evidence_version": "1.0",
      "execution": {
        "platform": "Windows-11-10.0.29695-SP0",
        "requested_platform": "tpu"
      },
      "interpretation": "A passing property confirms this relation for the recorded bounded input and backend only; a discrepancy is an observation requiring ordinary evidence review.",
      "kind": "metamorphic-property-evidence",
      "left_workload_sha256": "d1154fa844d5a82189845e52cbf1681f66c84c0538632243c42f1f862d4e1e72",
      "property": {
        "description": "Transposing a rank-two tensor twice restores the original tensor.",
        "identifier": "transpose-involution-v1",
        "relation": "outputs_equal",
        "title": "Double transpose is identity"
      },
      "requires_x64": false,
      "right_workload_sha256": "13deba9a38ba92f1dc2b7048d49d796b8187f7305dacddb2adb01fb491c8d1a4",
      "seed": 0,
      "triage": "pass"
    },
    {
      "backend": "jax-tpu-eager",
      "comparison": {
        "classification": "pass",
        "explanation": "outputs agree under the configured policy",
        "left": {
          "backend": "jax-tpu-simulated",
          "device": "TPU_0(process=0,(0,0,0,0))",
          "duration_ms": 0.4896,
          "environment": {
            "actual_devices": "cpu:0",
            "device_index": "",
            "jax": "0.10.2",
            "jax_enable_x64": "true",
            "platform": "Windows-11-10.0.29695-SP0",
            "requested_platform": "tpu",
            "simulated": "true",
            "simulation_backend": "cpu"
          },
          "error": null,
          "mode": "eager",
          "outputs": [
            {
              "dtype": "float32",
              "finite": 4,
              "shape": [
                2,
                2
              ]
            }
          ],
          "status": "ok"
        },
        "metrics": [
          {
            "dtype": "float32",
            "finite_mismatches": 0,
            "max_absolute_error": 0.0,
            "max_relative_error": 0.0,
            "mean_absolute_error": 0.0,
            "nonfinite_mismatches": 0,
            "rms_error": 0.0,
            "shape": [
              2,
              2
            ],
            "signed_zero_mismatches": 0
          }
        ],
        "policy": {
          "atol": 2e-06,
          "check_signed_zero": true,
          "equal_nan": true,
          "identifier": "dtype-aware-v1",
          "rtol": 2e-05
        },
        "right": {
          "backend": "jax-tpu-simulated",
          "device": "TPU_0(process=0,(0,0,0,0))",
          "duration_ms": 26.6354,
          "environment": {
            "actual_devices": "cpu:0",
            "device_index": "",
            "jax": "0.10.2",
            "jax_enable_x64": "true",
            "platform": "Windows-11-10.0.29695-SP0",
            "requested_platform": "tpu",
            "simulated": "true",
            "simulation_backend": "cpu"
          },
          "error": null,
          "mode": "eager",
          "outputs": [
            {
              "dtype": "float32",
              "finite": 4,
              "shape": [
                2,
                2
              ]
            }
          ],
          "status": "ok"
        }
      },
      "corpus_version": "1.0",
      "evidence_version": "1.0",
      "execution": {
        "platform": "Windows-11-10.0.29695-SP0",
        "requested_platform": "tpu"
      },
      "interpretation": "A passing property confirms this relation for the recorded bounded input and backend only; a discrepancy is an observation requiring ordinary evidence review.",
      "kind": "metamorphic-property-evidence",